{
  "command_dispositions": [
    {
      "command": "CMD_ADD_SHARED_VEHICLE_GROUP",
      "disposition": "policy-required",
      "evidence": [
        "config/v2/m19-air-contract.json",
        "config/v2/m19-air-evidence.json",
        "config/v2/m21-broad-contract.json"
      ],
      "occurrence": 1,
      "proof_kind": "bounded-higher-level-policy-transaction",
      "semantic_path": "all-mode-vehicle-transaction-authoritative-test-before-execute"
    },
    {
      "command": "CMD_ADD_VEHICLE_GROUP",
      "disposition": "policy-required",
      "evidence": [
        "config/v2/m19-air-contract.json",
        "config/v2/m19-air-evidence.json",
        "config/v2/m21-broad-contract.json"
      ],
      "occurrence": 1,
      "proof_kind": "bounded-higher-level-policy-transaction",
      "semantic_path": "all-mode-vehicle-transaction-authoritative-test-before-execute"
    },
    {
      "command": "CMD_ALTER_GROUP",
      "disposition": "policy-required",
      "evidence": [
        "config/v2/m20-competition-contract.json",
        "config/v2/m20-competition-evidence.json",
        "config/v2/m21-broad-contract.json"
      ],
      "occurrence": 1,
      "proof_kind": "bounded-higher-level-policy-transaction",
      "semantic_path": "company-finance-transaction-authoritative-test-before-execute"
    },
    {
      "command": "CMD_AUTOFILL_TIMETABLE",
      "disposition": "policy-required",
      "evidence": [
        "config/v2/m19-air-contract.json",
        "config/v2/m19-air-evidence.json",
        "config/v2/m21-broad-contract.json"
      ],
      "occurrence": 1,
      "proof_kind": "bounded-higher-level-policy-transaction",
      "semantic_path": "all-mode-vehicle-transaction-authoritative-test-before-execute"
    },
    {
      "command": "CMD_AUTOREPLACE_VEHICLE",
      "disposition": "policy-required",
      "evidence": [
        "integration/openttd/patches/15.3/m17/rail/0001-Add-native-V2-rail-qualification.patch",
        "config/v2/m19-air-contract.json",
        "config/v2/m19-air-evidence.json"
      ],
      "occurrence": 1,
      "proof_kind": "native-policy-command",
      "semantic_path": "all-mode-vehicle-transaction-native-test-execute"
    },
    {
      "command": "CMD_BUILD_AIRPORT",
      "disposition": "policy-required",
      "evidence": [
        "integration/openttd/patches/15.3/m19/air/0001-Add-native-V2-aircraft-qualification.patch",
        "config/v2/m19-air-contract.json",
        "config/v2/m19-air-evidence.json"
      ],
      "occurrence": 1,
      "proof_kind": "native-policy-command",
      "semantic_path": "air-transaction-native-test-execute"
    },
    {
      "command": "CMD_BUILD_BRIDGE",
      "disposition": "policy-required",
      "evidence": [
        "integration/openttd/patches/15.3/m18/ship/0001-Add-native-V2-ship-qualification.patch",
        "config/v2/m15-scalable-contract.json",
        "config/v2/m15-action-evidence.json"
      ],
      "occurrence": 1,
      "proof_kind": "native-policy-command",
      "semantic_path": "normal-company-generic-transaction-native-test-execute"
    },
    {
      "command": "CMD_BUILD_BUOY",
      "disposition": "policy-required",
      "evidence": [
        "integration/openttd/patches/15.3/m18/ship/0001-Add-native-V2-ship-qualification.patch",
        "config/v2/m18-ship-contract.json",
        "config/v2/m18-ship-evidence.json"
      ],
      "occurrence": 1,
      "proof_kind": "native-policy-command",
      "semantic_path": "water-transaction-native-test-execute"
    },
    {
      "command": "CMD_BUILD_CANAL",
      "disposition": "policy-required",
      "evidence": [
        "integration/openttd/patches/15.3/m18/ship/0001-Add-native-V2-ship-qualification.patch",
        "config/v2/m18-ship-contract.json",
        "config/v2/m18-ship-evidence.json"
      ],
      "occurrence": 1,
      "proof_kind": "native-policy-command",
      "semantic_path": "water-transaction-native-test-execute"
    },
    {
      "command": "CMD_BUILD_DOCK",
      "disposition": "policy-required",
      "evidence": [
        "integration/openttd/patches/15.3/m18/ship/0001-Add-native-V2-ship-qualification.patch",
        "config/v2/m18-ship-contract.json",
        "config/v2/m18-ship-evidence.json"
      ],
      "occurrence": 1,
      "proof_kind": "native-policy-command",
      "semantic_path": "water-transaction-native-test-execute"
    },
    {
      "command": "CMD_BUILD_INDUSTRY",
      "disposition": "policy-required",
      "evidence": [
        "config/v2/m16-cargo-contract.json",
        "config/v2/m16-cargo-evidence.json",
        "config/v2/m21-broad-contract.json"
      ],
      "occurrence": 1,
      "proof_kind": "bounded-higher-level-policy-transaction",
      "semantic_path": "road-cargo-transaction-authoritative-test-before-execute"
    },
    {
      "command": "CMD_BUILD_LOCK",
      "disposition": "policy-required",
      "evidence": [
        "integration/openttd/patches/15.3/m18/ship/0001-Add-native-V2-ship-qualification.patch",
        "config/v2/m18-ship-contract.json",
        "config/v2/m18-ship-evidence.json"
      ],
      "occurrence": 1,
      "proof_kind": "native-policy-command",
      "semantic_path": "water-transaction-native-test-execute"
    },
    {
      "command": "CMD_BUILD_LONG_ROAD",
      "disposition": "policy-required",
      "evidence": [
        "integration/openttd/patches/15.3/m05/0006-explicit-bus-actions-and-masks.patch",
        "config/v2/m16-cargo-contract.json",
        "config/v2/m16-cargo-evidence.json"
      ],
      "occurrence": 1,
      "proof_kind": "native-policy-command",
      "semantic_path": "road-cargo-transaction-native-test-execute"
    },
    {
      "command": "CMD_BUILD_RAILROAD_TRACK",
      "disposition": "policy-required",
      "evidence": [
        "config/v2/m17-rail-contract.json",
        "config/v2/m17-rail-evidence.json",
        "config/v2/m21-broad-contract.json"
      ],
      "occurrence": 1,
      "proof_kind": "bounded-higher-level-policy-transaction",
      "semantic_path": "rail-transaction-authoritative-test-before-execute"
    },
    {
      "command": "CMD_BUILD_RAIL_STATION",
      "disposition": "policy-required",
      "evidence": [
        "integration/openttd/patches/15.3/m17/rail/0001-Add-native-V2-rail-qualification.patch",
        "config/v2/m17-rail-contract.json",
        "config/v2/m17-rail-evidence.json"
      ],
      "occurrence": 1,
      "proof_kind": "native-policy-command",
      "semantic_path": "rail-transaction-native-test-execute"
    },
    {
      "command": "CMD_BUILD_RAIL_WAYPOINT",
      "disposition": "policy-required",
      "evidence": [
        "integration/openttd/patches/15.3/m17/rail/0001-Add-native-V2-rail-qualification.patch",
        "config/v2/m17-rail-contract.json",
        "config/v2/m17-rail-evidence.json"
      ],
      "occurrence": 1,
      "proof_kind": "native-policy-command",
      "semantic_path": "rail-transaction-native-test-execute"
    },
    {
      "command": "CMD_BUILD_ROAD",
      "disposition": "policy-required",
      "evidence": [
        "integration/openttd/patches/15.3/m02/scenario/0003-deterministic-passenger-bus-scenario-reset.patch",
        "config/v2/m16-cargo-contract.json",
        "config/v2/m16-cargo-evidence.json"
      ],
      "occurrence": 1,
      "proof_kind": "native-policy-command",
      "semantic_path": "road-cargo-transaction-native-test-execute"
    },
    {
      "command": "CMD_BUILD_ROAD_DEPOT",
      "disposition": "policy-required",
      "evidence": [
        "integration/openttd/patches/15.3/m02/scenario/0003-deterministic-passenger-bus-scenario-reset.patch",
        "config/v2/m16-cargo-contract.json",
        "config/v2/m16-cargo-evidence.json"
      ],
      "occurrence": 1,
      "proof_kind": "native-policy-command",
      "semantic_path": "road-cargo-transaction-native-test-execute"
    },
    {
      "command": "CMD_BUILD_ROAD_STOP",
      "disposition": "policy-required",
      "evidence": [
        "integration/openttd/patches/15.3/m02/scenario/0003-deterministic-passenger-bus-scenario-reset.patch",
        "config/v2/m16-cargo-contract.json",
        "config/v2/m16-cargo-evidence.json"
      ],
      "occurrence": 1,
      "proof_kind": "native-policy-command",
      "semantic_path": "road-cargo-transaction-native-test-execute"
    },
    {
      "command": "CMD_BUILD_ROAD_WAYPOINT",
      "disposition": "policy-required",
      "evidence": [
        "config/v2/m16-cargo-contract.json",
        "config/v2/m16-cargo-evidence.json",
        "config/v2/m21-broad-contract.json"
      ],
      "occurrence": 1,
      "proof_kind": "bounded-higher-level-policy-transaction",
      "semantic_path": "road-cargo-transaction-authoritative-test-before-execute"
    },
    {
      "command": "CMD_BUILD_SHIP_DEPOT",
      "disposition": "policy-required",
      "evidence": [
        "integration/openttd/patches/15.3/m18/ship/0001-Add-native-V2-ship-qualification.patch",
        "config/v2/m18-ship-contract.json",
        "config/v2/m18-ship-evidence.json"
      ],
      "occurrence": 1,
      "proof_kind": "native-policy-command",
      "semantic_path": "water-transaction-native-test-execute"
    },
    {
      "command": "CMD_BUILD_SIGNAL_TRACK",
      "disposition": "policy-required",
      "evidence": [
        "config/v2/m17-rail-contract.json",
        "config/v2/m17-rail-evidence.json",
        "config/v2/m21-broad-contract.json"
      ],
      "occurrence": 1,
      "proof_kind": "bounded-higher-level-policy-transaction",
      "semantic_path": "rail-transaction-authoritative-test-before-execute"
    },
    {
      "command": "CMD_BUILD_SINGLE_RAIL",
      "disposition": "policy-required",
      "evidence": [
        "integration/openttd/patches/15.3/m17/rail/0001-Add-native-V2-rail-qualification.patch",
        "config/v2/m17-rail-contract.json",
        "config/v2/m17-rail-evidence.json"
      ],
      "occurrence": 1,